{
  "schemaVersion": 1,
  "certificate": {
    "kind": "fixture",
    "organizationValidated": false,
    "keyCustody": "ephemeral-test-key",
    "revoked": false
  },
  "identity": { "oidc": false, "staticCredential": false },
  "approval": { "twoPerson": true, "changeControlId": "FIXTURE-ONLY" },
  "timestamp": { "verified": true, "url": "https://timestamp.invalid.test" },
  "store": { "identityMatches": true, "upgradeTested": true, "uninstallTested": true },
  "artifacts": [
    {
      "name": "apollo-x64.exe",
      "architecture": "x64",
      "unsignedSha256": "aaaaaaaaaaaaaaaaaaaaaaaaaaaaaaaaaaaaaaaaaaaaaaaaaaaaaaaaaaaaaaaa",
      "signedSha256": "bbbbbbbbbbbbbbbbbbbbbbbbbbbbbbbbbbbbbbbbbbbbbbbbbbbbbbbbbbbbbbbb",
      "sbomSha256": "dddddddddddddddddddddddddddddddddddddddddddddddddddddddddddddddd",
      "attestationSha256": "eeeeeeeeeeeeeeeeeeeeeeeeeeeeeeeeeeeeeeeeeeeeeeeeeeeeeeeeeeeeeeee",
      "logsRedacted": true,
      "verification": { "outcome": "valid", "architecture": "x64" }
    },
    {
      "name": "apollo-arm64.exe",
      "architecture": "arm64",
      "unsignedSha256": "ffffffffffffffffffffffffffffffffffffffffffffffffffffffffffffffff",
      "signedSha256": "cccccccccccccccccccccccccccccccccccccccccccccccccccccccccccccccc",
      "sbomSha256": "dddddddddddddddddddddddddddddddddddddddddddddddddddddddddddddddd",
      "attestationSha256": "eeeeeeeeeeeeeeeeeeeeeeeeeeeeeeeeeeeeeeeeeeeeeeeeeeeeeeeeeeeeeeee",
      "logsRedacted": true,
      "verification": { "outcome": "valid", "architecture": "arm64" }
    }
  ]
}
